{"categories":{"list":[{"cardinality":"bijective","id":"drinks","label":"Drinks","ordinal":false,"values":[{"glyph":"drinks.cocktail","id":"cocktail","label":"Cocktail"},{"glyph":"drinks.coffee","id":"coffee","label":"Coffee"},{"glyph":"drinks.soda","id":"soda","label":"Soda"}]},{"cardinality":"bijective","id":"household","label":"Household","ordinal":false,"values":[{"glyph":"household.axe","id":"axe","label":"Axe"},{"glyph":"household.juice","id":"juice","label":"Juice"},{"glyph":"household.knives","id":"knives","label":"Knives"}]}],"n":2},"constraints":[{"clueText":"Cocktail sits with the Knives.","id":"c1","operands":[{"cat":"drinks","value":"cocktail"},{"cat":"household","value":"knives"}],"params":{},"renderHint":"eq","type":"eq"},{"clueText":"Soda sits with the Axe.","id":"c2","operands":[{"cat":"drinks","value":"soda"},{"cat":"household","value":"axe"}],"params":{},"renderHint":"eq","type":"eq"}],"entities":["e0","e1","e2"],"hintTrace":[{"forces":{"cat":"household","entity":"e2","value":"axe"},"fromClues":["c2"]},{"forces":{"cat":"household","entity":"e1","value":"juice"},"fromClues":["c1"]},{"forces":{"cat":"household","entity":"e0","value":"knives"},"fromClues":["c1"]}],"puzzleId":"2026-06-25","schemaVersion":1,"shapeId":"grid","solution":{"e0":{"drinks":"cocktail","household":"knives"},"e1":{"drinks":"coffee","household":"juice"},"e2":{"drinks":"soda","household":"axe"}},"templateRev":1,"tier":"easy"}
