{"categories":{"list":[{"anchor":true,"cardinality":"bijective","id":"name","kind":"nominal","label":"Friend","ordinal":false,"values":[{"glyph":"","id":"dev","label":"Dev"},{"glyph":"","id":"ben","label":"Ben"},{"glyph":"","id":"eli","label":"Eli"},{"glyph":"","id":"fay","label":"Fay"},{"glyph":"","id":"ana","label":"Ana"}]},{"cardinality":"bijective","id":"craft","kind":"nominal","label":"Craft","ordinal":false,"values":[{"glyph":"","id":"honey","label":"Honey","phrase":"jarred the honey","refPhrase":"beekeeper"},{"glyph":"","id":"candles","label":"Candles","phrase":"made the candles","refPhrase":"candle-maker"},{"glyph":"","id":"pottery","label":"Pottery","phrase":"threw the pottery","refPhrase":"potter"},{"glyph":"","id":"soap","label":"Soap","phrase":"made the soap","refPhrase":"soap-maker"},{"glyph":"","id":"jam","label":"Jam","phrase":"made the jam","refPhrase":"jam-maker"}]},{"cardinality":"bijective","id":"price","kind":"numeric","label":"Price","ordinal":true,"unit":"dollars","values":[{"glyph":"","id":"p12","label":"$12","magnitude":12,"phrase":"charged 12 dollars"},{"glyph":"","id":"p20","label":"$20","magnitude":20,"phrase":"charged 20 dollars"},{"glyph":"","id":"p10","label":"$10","magnitude":10,"phrase":"charged 10 dollars"},{"glyph":"","id":"p8","label":"$8","magnitude":8,"phrase":"charged 8 dollars"},{"glyph":"","id":"p15","label":"$15","magnitude":15,"phrase":"charged 15 dollars"}]},{"cardinality":"bijective","id":"produce","kind":"nominal","label":"Produce","ordinal":false,"values":[{"glyph":"","id":"bread","label":"Bread","phrase":"also brought the bread","refPhrase":"bread seller"},{"glyph":"","id":"cheese","label":"Cheese","phrase":"also brought the cheese","refPhrase":"cheese seller"},{"glyph":"","id":"plums","label":"Plums","phrase":"also brought the plums","refPhrase":"plum seller"},{"glyph":"","id":"eggs","label":"Eggs","phrase":"also brought the eggs","refPhrase":"egg seller"},{"glyph":"","id":"olives","label":"Olives","phrase":"also brought the olives","refPhrase":"olive seller"}]}],"n":4},"constraints":[{"clueText":"$10's table was the one that also brought the bread.","id":"c1","operands":[{"cat":"price","value":"p10"},{"cat":"produce","value":"bread"}],"params":{},"renderHint":"eq","type":"eq"},{"clueText":"Ben brought either the Jam or the Honey - not both.","id":"c2","operands":[{"cat":"name","value":"ben"},{"cat":"craft","value":"jam"},{"cat":"craft","value":"honey"}],"params":{},"renderHint":"oneOf","type":"oneOf"},{"clueText":"The one who also brought the cheese was the beekeeper.","id":"c3","operands":[{"cat":"craft","value":"honey"},{"cat":"produce","value":"cheese"}],"params":{},"renderHint":"eq","type":"eq"},{"clueText":"The one who charged 15 dollars was the soap-maker.","id":"c4","operands":[{"cat":"craft","value":"soap"},{"cat":"price","value":"p15"}],"params":{},"renderHint":"eq","type":"eq"},{"clueText":"The one who also brought the plums was the potter.","id":"c5","operands":[{"cat":"craft","value":"pottery"},{"cat":"produce","value":"plums"}],"params":{},"renderHint":"eq","type":"eq"},{"clueText":"Eli's takings came to 5 dollars more than Fay's.","id":"c6","operands":[{"cat":"name","value":"eli"},{"cat":"name","value":"fay"}],"params":{"delta":5,"dir":"greater","numericCat":"price"},"renderHint":"numDiff","type":"numDiff"},{"clueText":"Of Dev and Eli, one also brought the cheese and the other also brought the plums.","id":"c7","operands":[{"cat":"name","value":"dev"},{"cat":"name","value":"eli"},{"cat":"produce","value":"cheese"},{"cat":"produce","value":"plums"}],"params":{},"renderHint":"oneEachOf","type":"oneEachOf"},{"clueText":"Of Dev and Ana, one also brought the cheese and the other also brought the eggs.","id":"c8","operands":[{"cat":"name","value":"dev"},{"cat":"name","value":"ana"},{"cat":"produce","value":"cheese"},{"cat":"produce","value":"eggs"}],"params":{},"renderHint":"oneEachOf","type":"oneEachOf"},{"clueText":"Ana did not charge less than 12 dollars.","id":"c9","operands":[{"cat":"name","value":"ana"}],"params":{"bound":12,"dir":"atleast","numericCat":"price"},"renderHint":"threshold","type":"threshold"}],"entities":["e0","e1","e2","e3","e4"],"hintTrace":[{"forces":{"cat":"craft","entity":"e0","value":"honey"},"fromClues":["c2","c3"]},{"forces":{"cat":"craft","entity":"e4","value":"candles"},"fromClues":["c1"]},{"forces":{"cat":"craft","entity":"e2","value":"pottery"},"fromClues":["c5"]},{"forces":{"cat":"craft","entity":"e3","value":"soap"},"fromClues":["c4"]},{"forces":{"cat":"craft","entity":"e1","value":"jam"},"fromClues":["c2"]},{"forces":{"cat":"price","entity":"e4","value":"p12"},"fromClues":["c1"]},{"forces":{"cat":"price","entity":"e2","value":"p20"},"fromClues":["c1"]},{"forces":{"cat":"price","entity":"e1","value":"p10"},"fromClues":["c1"]},{"forces":{"cat":"price","entity":"e0","value":"p8"},"fromClues":["c1"]},{"forces":{"cat":"price","entity":"e3","value":"p15"},"fromClues":["c4"]},{"forces":{"cat":"produce","entity":"e1","value":"bread"},"fromClues":["c1"]},{"forces":{"cat":"produce","entity":"e0","value":"cheese"},"fromClues":["c3","c7","c8"]},{"forces":{"cat":"produce","entity":"e2","value":"plums"},"fromClues":["c5","c7"]},{"forces":{"cat":"produce","entity":"e4","value":"eggs"},"fromClues":["c8"]},{"forces":{"cat":"produce","entity":"e3","value":"olives"},"fromClues":["c1"]}],"puzzleId":"2026-07-02","scenarioId":"weekend-market","schemaVersion":1,"shapeId":"grid","solution":{"e0":{"craft":"honey","name":"dev","price":"p8","produce":"cheese"},"e1":{"craft":"jam","name":"ben","price":"p10","produce":"bread"},"e2":{"craft":"pottery","name":"eli","price":"p20","produce":"plums"},"e3":{"craft":"soap","name":"fay","price":"p15","produce":"olives"},"e4":{"craft":"candles","name":"ana","price":"p12","produce":"eggs"}},"story":"Every Saturday, five friends run neighbouring stalls at the riverside craft market, watched over by old Mrs. Alvarez, who has kept the market ledger for forty years and still records every sale in green ink. This week each friend brought a different handmade craft and settled on a different price. Mrs. Alvarez has misplaced the ledger page - match every friend to the craft they made and the price they charged.","subjectNoun":"friend","templateRev":1,"tier":"sharp","variant":1}
