{"categories":{"list":[{"cardinality":"bijective","id":"drink","label":"Drink","ordinal":false,"values":[{"glyph":"household.tea","id":"tea","label":"Tea"},{"glyph":"household.coffee","id":"coffee","label":"Coffee"},{"glyph":"household.milk","id":"milk","label":"Milk"},{"glyph":"household.cola","id":"cola","label":"Cola"}]},{"cardinality":"bijective","id":"animal","label":"Animal","ordinal":false,"values":[{"glyph":"creatures.cat","id":"cat","label":"Cat"},{"glyph":"creatures.dog","id":"dog","label":"Dog"},{"glyph":"creatures.fish","id":"fish","label":"Fish"},{"glyph":"creatures.bird","id":"bird","label":"Bird"}]},{"cardinality":"bijective","id":"position","label":"Seat","ordinal":true,"values":[{"glyph":"abstract.num1","id":"num1","label":"1"},{"glyph":"abstract.num2","id":"num2","label":"2"},{"glyph":"abstract.num3","id":"num3","label":"3"},{"glyph":"abstract.num4","id":"num4","label":"4"}]}],"n":3},"constraints":[{"clueText":"Cola sits with the 1.","id":"c1","operands":[{"cat":"drink","value":"cola"},{"cat":"position","value":"num1"}],"params":{},"renderHint":"eq","type":"eq"},{"clueText":"Cat sits with the 1.","id":"c2","operands":[{"cat":"animal","value":"cat"},{"cat":"position","value":"num1"}],"params":{},"renderHint":"eq","type":"eq"},{"clueText":"Coffee sits with the 2.","id":"c3","operands":[{"cat":"drink","value":"coffee"},{"cat":"position","value":"num2"}],"params":{},"renderHint":"eq","type":"eq"},{"clueText":"Fish sits with the 4.","id":"c4","operands":[{"cat":"animal","value":"fish"},{"cat":"position","value":"num4"}],"params":{},"renderHint":"eq","type":"eq"},{"clueText":"Tea sits with the Bird.","id":"c5","operands":[{"cat":"drink","value":"tea"},{"cat":"animal","value":"bird"}],"params":{},"renderHint":"eq","type":"eq"}],"entities":["e0","e1","e2","e3"],"hintTrace":[{"forces":{"cat":"drink","entity":"e2","value":"tea"},"fromClues":["c5"]},{"forces":{"cat":"drink","entity":"e1","value":"coffee"},"fromClues":["c3"]},{"forces":{"cat":"drink","entity":"e3","value":"milk"},"fromClues":["c1"]},{"forces":{"cat":"drink","entity":"e0","value":"cola"},"fromClues":["c1"]},{"forces":{"cat":"animal","entity":"e0","value":"cat"},"fromClues":["c2"]},{"forces":{"cat":"animal","entity":"e1","value":"dog"},"fromClues":["c1"]},{"forces":{"cat":"animal","entity":"e3","value":"fish"},"fromClues":["c4"]},{"forces":{"cat":"animal","entity":"e2","value":"bird"},"fromClues":["c5"]}],"puzzleId":"2026-06-29","schemaVersion":1,"shapeId":"seating-row","solution":{"e0":{"animal":"cat","drink":"cola","position":"num1"},"e1":{"animal":"dog","drink":"coffee","position":"num2"},"e2":{"animal":"bird","drink":"tea","position":"num3"},"e3":{"animal":"fish","drink":"milk","position":"num4"}},"templateRev":1,"tier":"standard"}
